{
  "$schema": "https://json-schema.org/draft/2020-12/schema",
  "title": "RssItem",
  "description": "A single RSS feed article item.",
  "$id": "https://raw.githubusercontent.com/api-evangelist/zdnet/refs/heads/main/json-schema/rss-rss-item-schema.json",
  "type": "object",
  "properties": {
    "title": {
      "type": "string",
      "description": "Article title.",
      "example": "New AI breakthrough announced"
    },
    "link": {
      "type": "string",
      "format": "uri",
      "description": "Article URL.",
      "example": "https://www.zdnet.com/article/example"
    },
    "description": {
      "type": "string",
      "description": "Article summary.",
      "example": "Article summary text."
    },
    "author": {
      "type": "string",
      "description": "Article author.",
      "example": "Jane Smith"
    },
    "pubDate": {
      "type": "string",
      "format": "date-time",
      "description": "Publication date.",
      "example": "2026-05-01T12:00:00Z"
    },
    "category": {
      "type": "array",
      "description": "Article categories.",
      "items": {
        "type": "string"
      },
      "example": [
        "AI",
        "Innovation"
      ]
    },
    "guid": {
      "type": "string",
      "description": "Unique article identifier.",
      "example": "https://www.zdnet.com/article/example#guid"
    }
  },
  "required": [
    "title",
    "link"
  ]
}